{
  "schema_version": "delta_manifest.v1",
  "seller_id": "ic-client-990007",
  "round_id": "round-0001",
  "model_version": "model-0001",
  "manifest_hash": "3f8c1b2d4e6a7c9b0d1e2f3a4b5c6d7e8f90a1b2c3d4e5f60718293a4b5c6d7e",
  "architecture_version": 1,
  "completed": false,
  "tensors": [
    {
      "name": "shared.time_mlp",
      "shape": [
        3,
        64
      ],
      "dtype": "float32"
    }
  ]
}
